{
    "$schema": "schemas/resume.schema.json",
    "meta": {
        "version": "1.0.0",
        "date": "2024-11-09"
    },
    "info": {
        "firstname": "Joseph",
        "lastname": "Komskis",
        "github": "https://github.com/JKomskis",
        "website": "https://komsk.is"
    },
    "contact": {
        "linkedin": "https://linkedin.com/in/joseph-komskis"
    },
    "education": [
        {
            "name": "Georgia Institute of Technology",
            "degree": "Master of Science in Computer Science",
            "location": {
                "city": "Atlanta",
                "state": "GA"
            },
            "graduated": "2022-05",
            "highlights": [
                "GPA: 4.0",
                "Specialization: Computing Systems",
                "Relevant Coursework: Advanced Operating Systems, System Design in Cloud Computing, Database System Implementation, High Performance Computer Architecture, Computer Networks, Graduate Algorithms, Programming Languages"
            ]
        },
        {
            "name": "University of Florida",
            "degree": "Bachelor of Science in Computer Science",
            "location": {
                "city": "Gainesville",
                "state": "FL"
            },
            "graduated": "2020-05",
            "highlights": [
                "GPA: 3.98; Cum Laude; Honors Program",
                "Minor: Business Administration"
            ]
        }
    ],
    "skills": [
        {
            "category": "Languages",
            "examples": [
                "C++",
                "Python",
                "Java",
                "PowerShell",
                "SQL",
                "Rust",
                "Go",
                "HTML",
                "CSS",
                "JavaScript",
                "React",
                "Kotlin",
                "Haskell"
            ]
        },
        {
            "category": "Tools/Technologies",
            "examples": [
                "Git",
                "GitHub",
                "Spark",
                "Hadoop",
                "Docker",
                "Etcd",
                "MongoDB",
                "NodeJS",
                "Azure",
                "LaTeX",
                "K8s",
                "ANTLR"
            ]
        },
        {
            "category": "Processes",
            "examples": [
                "Agile Development",
                "Scrum",
                "Kanban",
                "Code Review",
                "CI/CD",
                "TDD",
                "ER Modeling",
                "UML Modeling"
            ]
        }
    ],
    "experience": [
        {
            "company": "Microsoft",
            "location": {
                "city": "Redmond",
                "state": "WA"
            },
            "positions": [
                {
                    "title": "Software Engineer II",
                    "start": "2024-09"
                },
                {
                    "title": "Software Engineer",
                    "start": "2022-08",
                    "end": "2024-09"
                }
            ],
            "highlights": [
                "Worked on the ADLS Gen2 team",
                "Reduced recursive listing latency by 6x-12x by optimizing namespace calls and reducing name resolution calls",
                "Improved system performance by implementing a 0-copy interface for entities"
            ]
        },
        {
            "company": "Georgia Institute of Technology",
            "location": {
                "city": "Atlanta",
                "state": "GA"
            },
            "positions": [
                {
                    "title": "Graduate Teaching Assistant - Advanced Operating Systems",
                    "start": "2022-01",
                    "end": "2022-05"
                },
                {
                    "title": "Graduate Teaching Assistant - Introduction to Database Systems",
                    "start": "2021-01",
                    "end": "2021-12"
                }
            ],
            "highlights": [
                "Built an autograding pipeline for student projects using Azure Batch to provide students with immediate grading feedback",
                "Created and graded phases of a semester group project focused on designing and implementing a database application",
                "Drafted exam questions and grading rubrics; graded exams"
            ]
        },
        {
            "company": "Microsoft",
            "location": {
                "city": "Ft Lauderdale",
                "state": "FL"
            },
            "positions": [
                {
                    "title": "Software Engineering Intern (Virtual Internship)",
                    "start": "2021-05",
                    "end": "2021-08"
                }
            ],
            "highlights": [
                "Designed and implemented a proof-of-concept platform for moving compute heavy tasks from Azure Storage using Spark",
                "Analyzed several deployment options and weighed their tradeoffs in several aspects, such as control, scalability, and security",
                "Tested the performance of the existing query acceleration feature and proposed a new hybrid query processing approach"
            ]
        }
    ],
    "projects": [
        {
            "name": "MapReduce in Go",
            "context": "System Design in Cloud Computing Pair Project (Go)",
            "start": "2022-01",
            "end": "2022-05",
            "highlights": [
                "Recreated MapReduce in Go, with master failover capabilities, and deployed on Azure Kubernetes Service",
                "Implemented the logic for master failover and communication of tasks from leader node to worker nodes"
            ]
        },
        {
            "name": "SQL Typecheck",
            "context": "Programming Languages Term Project (Python)",
            "start": "2022-01",
            "end": "2022-05",
            "highlights": [
                "Defined an abstract syntax and typing rules for a subset of SQL",
                "Implemented and unit tested a parser and type checker for queries"
            ]
        }
    ],
    "leadership": [
        {
            "organization": "University of Florida Programming Team",
            "location": {
                "city": "Gainesville",
                "state": "FL"
            },
            "positions": [
                {
                    "title": "Captain",
                    "start": "2019-01",
                    "end": "2020-05"
                },
                {
                    "title": "Lead",
                    "start": "2018-09",
                    "end": "2019-01"
                }
            ],
            "highlights": [
                "Competed in ACM Programming Competitions focusing on data structures and algorithms",
                "Led meetings and taught competitive programming topics such as algorithm complexity",
                "Organized an interview workshop to teach tips and techniques for behavioral and technical questions",
                "SER 2017: 20/47    SER 2018: 10/36    SER 2019: 11/36"
            ]
        }
    ]
}